{
  "$schema": "../../schemas/pipe01/source_manifest.schema.json",
  "manifest_id": "DATA03_ACS2024_ACS5_B15003_WI_TRACT_SOURCE_MANIFEST_V1",
  "manifest_version": "1.0.0",
  "source_id": "census-acs-2024-acs5-detailed-b15003",
  "source_name": "2020-2024 ACS 5-Year Detailed Table B15003",
  "publisher": "U.S. Census Bureau",
  "accepted_vintage": "2024",
  "source_reference": "https://www2.census.gov/programs-surveys/acs/summary_file/2024/table-based-SF/data/5YRData/acsdt5y2024-b15003.dat",
  "official_product_identity": "2020-2024 ACS 5-Year Detailed Tables, official table-based Summary File, B15003",
  "source_filename": "acsdt5y2024-b15003.dat",
  "source_geography_and_type": "National table-based Detailed Table B15003 file, deterministically filtered to GEO_ID prefix 1400000US55 for Wisconsin Census tracts.",
  "retrieval": {
    "method": "HTTPS GET of the exact source_reference URL; no latest/current alias or API credential is used.",
    "retrieval_date": "2026-08-23",
    "expected_byte_length": 92292840,
    "access_surface_reason": "The exact 2024 Census data endpoint returned its Missing Key gate without a credential. Exact official 2024 Detailed Table files provide the same release and variable evidence without committing or requiring credentials."
  },
  "request_identity": {
    "access_surface": "official ACS table-based Summary File HTTPS distribution",
    "source_file": "acsdt5y2024-b15003.dat",
    "record_delimiter": "LF",
    "field_delimiter": "|",
    "header_required": [
      "GEO_ID",
      "B15003_E001",
      "B15003_M001",
      "B15003_E022",
      "B15003_M022",
      "B15003_E023",
      "B15003_M023",
      "B15003_E024",
      "B15003_M024",
      "B15003_E025",
      "B15003_M025"
    ],
    "geography_selection": "Rows whose GEO_ID begins exactly 1400000US55; no market target or seed filtering.",
    "metadata_reference": "https://api.census.gov/data/2024/acs/acs5/groups/B15003.json",
    "source_to_contract_mapping": {
      "B15003_E001": "B15003_001E",
      "B15003_E022": "B15003_022E",
      "B15003_E023": "B15003_023E",
      "B15003_E024": "B15003_024E",
      "B15003_E025": "B15003_025E",
      "B15003_M001": "B15003_001M",
      "B15003_M022": "B15003_022M",
      "B15003_M023": "B15003_023M",
      "B15003_M024": "B15003_024M",
      "B15003_M025": "B15003_025M"
    }
  },
  "request_hash_algorithm": "SHA-256",
  "request_hash_semantics": "SHA-256 of canonical UTF-8 JSON for request_identity: recursively sorted object keys compact separators Unicode preserved no NaN.",
  "request_sha256": "5b688e9d9264c8aee1bf7a8b0af369a548c8c9f125fc17dda14526a974e05eb5",
  "checksum_algorithm": "SHA-256",
  "byte_sha256": "d0c8609e958022459215c8a31d7452ef7528ee8dd70fbb6f9a99de0f491f42d7",
  "checksum_semantics": "SHA-256 over the exact downloaded acsdt5y2024-b15003.dat bytes before filtering parsing normalization or conversion.",
  "acquisition_state": "acquired",
  "schema_version": "data-authoritative-source-manifest-v1",
  "expected_file_properties": {
    "container": "UTF-8-compatible pipe-delimited text with one header row",
    "required_source_fields": [
      "GEO_ID",
      "B15003_E001",
      "B15003_M001",
      "B15003_E022",
      "B15003_M022",
      "B15003_E023",
      "B15003_M023",
      "B15003_E024",
      "B15003_M024",
      "B15003_E025",
      "B15003_M025"
    ],
    "required_contract_estimate_fields": [
      "B15003_001E",
      "B15003_022E",
      "B15003_023E",
      "B15003_024E",
      "B15003_025E"
    ],
    "required_contract_moe_fields": [
      "B15003_001M",
      "B15003_022M",
      "B15003_023M",
      "B15003_024M",
      "B15003_025M"
    ],
    "selected_metadata_identity_sha256": "bc531aac59661c070e86c38ae2278441962c18ff1cf0625bcf12a018e42fcc10",
    "expected_wisconsin_tract_row_count_at_retrieval": 1542
  },
  "annotation_and_special_value_contract": {
    "official_reference": "https://www.census.gov/data/developers/data-sets/acs-1year/notes-on-acs-estimate-and-annotation-values.html",
    "api_annotation_state": "The official metadata defines paired annotation variables, but the selected table-based file contains no annotation columns.",
    "required_parser_behavior": "Preserve raw estimate and MOE tokens. Apply the DATA-03 special-value contract; missing suppressed inapplicable special or invalid evidence remains noncomputable and never becomes zero."
  },
  "reproduction": "Download exactly source_reference as acsdt5y2024-b15003.dat; require exact byte length SHA-256 header mapping metadata identity and 1,542 unique Wisconsin tract rows before downstream use.",
  "failure_behavior": "Fail closed on unavailable source product vintage filename byte length checksum header metadata estimate/MOE pairing duplicate tract special value malformed record or Wisconsin coverage mismatch for B15003. Do not substitute another release table geography or zero.",
  "attribution": "U.S. Census Bureau, American Community Survey 2020-2024 5-Year Detailed Table B15003.",
  "lineage": {
    "controlling_decision": "DATA-03: Wisconsin Multivariate ACS Feature Source Expansion",
    "data_contract_id": "DATA03_WISCONSIN_MULTIVARIATE_ACS_FEATURE_SOURCE_CONTRACT_V1",
    "data_contract_version": "1.0.0",
    "data_contract_content_sha256": "c20814fe55047889a1dc49c39e8d93ba875fe9b0caccaa8a12f0ee58b11f004d",
    "additive_to": "DATA01_VALIDATION_SOURCE_CONTRACT_V1; accepted DATA-01 authority is unchanged.",
    "model_boundary": "Source variables and documented source-safe derivations only; no final model feature selection fitting scoring or target-conditioned authority."
  },
  "supersedes": null,
  "supersession_policy": "A correction or newly accepted release requires a new manifest ID/version and explicit supersedes lineage; never overwrite this accepted manifest.",
  "manifest_content_sha256": "b6b7c30a658e7f0d695c45f66fd50516a854f25ad66e13688a44648d0d6b60fd"
}
